{
  "report_id": "report-civil-loan-001-01",
  "case_id": "case-civil-loan-001",
  "run_id": "run-civil-loan-001-report-01",
  "title": "民间借贷纠纷诊断报告 - 张三诉李四借款合同纠纷",
  "summary": "本报告针对张三诉李四民间借贷纠纷案进行全面诊断。案件核心争点包括：借贷关系是否成立、借款金额的认定、还款事实的认定以及利息计算标准。根据现有证据分析，借条原件（evidence-civil-loan-001-01）可证明借贷合意成立，转账记录（evidence-civil-loan-001-02）可佐证款项交付事实。但被告主张的部分还款事实缺乏直接书证支持，仅有证人证言（evidence-civil-loan-001-04），证明力较弱。利息约定方面，借条载明月利率2%，未超过法定上限。综合评估，原告胜诉可能性较高，建议重点关注被告还款抗辩的证据补强。",
  "sections": [
    {
      "section_id": "sec-civil-loan-001-01",
      "section_index": 1,
      "title": "案件概述",
      "body": "本案为民间借贷纠纷，原告张三主张被告李四于2023年3月15日向其借款人民币50万元，约定借期一年，月利率2%，到期后被告未按约还款。被告李四辩称已通过现金方式归还20万元，剩余部分因经营困难请求延期。案件现进入一审程序。",
      "linked_issue_ids": ["issue-civil-loan-001-root"],
      "linked_output_ids": ["output-civil-loan-001-fact-finding-01"],
      "linked_evidence_ids": ["evidence-civil-loan-001-01", "evidence-civil-loan-001-02"],
      "key_conclusions": [
        {
          "conclusion_id": "concl-civil-loan-001-01-01",
          "text": "本案属于民间借贷纠纷，适用《民法典》合同编及相关司法解释",
          "statement_class": "fact",
          "supporting_evidence_ids": ["evidence-civil-loan-001-01"],
          "supporting_output_ids": ["output-civil-loan-001-fact-finding-01"]
        }
      ]
    },
    {
      "section_id": "sec-civil-loan-001-02",
      "section_index": 2,
      "title": "借贷关系认定",
      "body": "借贷关系的成立需要同时满足借贷合意和款项交付两个要件。本案中，借条原件明确记载了借款金额、利率、期限等关键条款，可证明双方存在借贷合意。银行转账记录显示原告于借条签署当日向被告账户转入50万元，与借条记载金额一致，可证明款项已实际交付。因此，50万元借贷关系成立的证据较为充分。",
      "linked_issue_ids": ["issue-civil-loan-001-01", "issue-civil-loan-001-02"],
      "linked_output_ids": ["output-civil-loan-001-fact-finding-01", "output-civil-loan-001-legal-analysis-01"],
      "linked_evidence_ids": ["evidence-civil-loan-001-01", "evidence-civil-loan-001-02", "evidence-civil-loan-001-03"],
      "key_conclusions": [
        {
          "conclusion_id": "concl-civil-loan-001-02-01",
          "text": "借条原件与转账记录相互印证，50万元借贷关系成立",
          "statement_class": "fact",
          "supporting_evidence_ids": ["evidence-civil-loan-001-01", "evidence-civil-loan-001-02"],
          "supporting_output_ids": ["output-civil-loan-001-fact-finding-01"]
        },
        {
          "conclusion_id": "concl-civil-loan-001-02-02",
          "text": "借条中关于利率和期限的约定合法有效，受法律保护",
          "statement_class": "inference",
          "supporting_evidence_ids": ["evidence-civil-loan-001-01"],
          "supporting_output_ids": ["output-civil-loan-001-legal-analysis-01"]
        }
      ]
    },
    {
      "section_id": "sec-civil-loan-001-03",
      "section_index": 3,
      "title": "还款与利息争议",
      "body": "被告主张已通过现金方式归还20万元，但未能提供收据、转账记录等直接书证。被告提供的证人王五证言称曾在场见证现金交付，但该证人与被告存在亲属关系，证明力较弱。根据《最高人民法院关于审理民间借贷案件适用法律若干问题的规定》，被告对其已还款的主张承担举证责任。在缺乏直接书证的情况下，法院采信被告还款主张的可能性较低。利息方面，借条约定月利率2%（年利率24%），未超过司法保护上限，应予支持。",
      "linked_issue_ids": ["issue-civil-loan-001-03", "issue-civil-loan-001-04"],
      "linked_output_ids": ["output-civil-loan-001-legal-analysis-01", "output-civil-loan-001-risk-assessment-01"],
      "linked_evidence_ids": ["evidence-civil-loan-001-01", "evidence-civil-loan-001-04", "evidence-civil-loan-001-05"],
      "key_conclusions": [
        {
          "conclusion_id": "concl-civil-loan-001-03-01",
          "text": "被告还款主张缺乏直接书证支持，仅有利害关系证人的证言，证明力不足",
          "statement_class": "inference",
          "supporting_evidence_ids": ["evidence-civil-loan-001-04"],
          "supporting_output_ids": ["output-civil-loan-001-legal-analysis-01"]
        },
        {
          "conclusion_id": "concl-civil-loan-001-03-02",
          "text": "月利率2%未超过法定上限，利息主张应予支持",
          "statement_class": "fact",
          "supporting_evidence_ids": ["evidence-civil-loan-001-01", "evidence-civil-loan-001-05"],
          "supporting_output_ids": ["output-civil-loan-001-legal-analysis-01"]
        },
        {
          "conclusion_id": "concl-civil-loan-001-03-03",
          "text": "如被告在诉讼中补充提供还款的转账记录或其他书证，可能改变法院对还款事实的认定",
          "statement_class": "assumption",
          "supporting_evidence_ids": ["evidence-civil-loan-001-04"],
          "supporting_output_ids": ["output-civil-loan-001-risk-assessment-01"]
        }
      ]
    },
    {
      "section_id": "sec-civil-loan-001-04",
      "section_index": 4,
      "title": "风险评估与建议",
      "body": "综合评估本案证据情况，原告胜诉可能性较高。主要风险点在于：（1）被告可能在诉讼中补充提供还款证据；（2）被告可能对借条签名真实性提出鉴定申请；（3）如案件进入执行程序，被告的偿还能力存在不确定性。建议原告方：第一，提前准备应对被告可能提出的笔迹鉴定；第二，关注被告财产线索，必要时申请财产保全；第三，对于利息计算保留详细的计算说明。",
      "linked_issue_ids": ["issue-civil-loan-001-root", "issue-civil-loan-001-03"],
      "linked_output_ids": ["output-civil-loan-001-risk-assessment-01"],
      "linked_evidence_ids": ["evidence-civil-loan-001-01", "evidence-civil-loan-001-02", "evidence-civil-loan-001-04"],
      "key_conclusions": [
        {
          "conclusion_id": "concl-civil-loan-001-04-01",
          "text": "原告胜诉可能性较高，核心证据链完整",
          "statement_class": "inference",
          "supporting_evidence_ids": ["evidence-civil-loan-001-01", "evidence-civil-loan-001-02"],
          "supporting_output_ids": ["output-civil-loan-001-risk-assessment-01"]
        },
        {
          "conclusion_id": "concl-civil-loan-001-04-02",
          "text": "被告可能对借条签名提出鉴定申请，需提前准备应对方案",
          "statement_class": "assumption",
          "supporting_evidence_ids": ["evidence-civil-loan-001-01"],
          "supporting_output_ids": ["output-civil-loan-001-risk-assessment-01"]
        },
        {
          "conclusion_id": "concl-civil-loan-001-04-03",
          "text": "建议申请财产保全以确保判决可执行",
          "statement_class": "inference",
          "supporting_evidence_ids": ["evidence-civil-loan-001-04"],
          "supporting_output_ids": ["output-civil-loan-001-risk-assessment-01"]
        }
      ]
    }
  ],
  "created_at": "2026-03-24T10:00:00Z"
}